17:49:31.665741 ARP, Request who-has 192.168.0.180 tell 192.168.0.8, length 46
17:49:31.695257 IP 192.168.0.84.50006 > 239.255.255.250.1900: UDP, length 174
17:49:31.726218 IP 192.168.0.88.63379 > 239.255.255.250.1900: UDP, length 175
17:49:31.814965 IP 192.168.0.230.59440 > 239.255.255.250.1900: UDP, length 174
17:49:31.818374 STP 802.1w, Rapid STP, Flags [Learn, Forward, Agreement], bridge-id 8000.18:7a:3b:cd:42:9b.8006, length 36
17:49:31.916232 ARP, Request who-has 201.182.221.114 tell 201.182.221.113, length 46
17:49:31.950057 IP 192.168.0.25.5353 > 224.0.0.251.5353: 0 TXT (QM)? HP LaserJet 400 M401dne (7740E9)._ipp._tcp.local. (66)
17:49:31.950272 IP 192.168.0.157.5353 > 224.0.0.251.5353: 0*- [0q] 1/0/1 (Cache flush) TXT "txtvers=1" "qtotal=1" "pdl=application/postscript,application/vnd.hp-PCL,application/vnd.hp-PCLXL,application/pdf,application/PCLm,application/octet-stream,image/urf" "rp=ipp/print" "URF=V1.1,CP99,W8,OB10,PQ3-4-5,DM1,IS1-2-4,MT1-2-3-5,RS600-1200" "ty=HP LaserJet 400 M401dne" "product=(HP LaserJet 400 M401dne)" "priority=10" "adminurl=http://NPI7740E9.local." "note=" "Color=F" "Duplex=T" "Scan=F" "Fax=F" "UUID=42524453-4644-4647-3843-a01d487740e9" "usb_MFG=Hewlett-Packard" "usb_MDL=HP LaserJet 400 M401dne" "mac=a0:1d:48:77:40:e9" (593)
17:49:31.950417 IP6 fe80::a6dd:c703:eec:6aa2.5353 > ff02::fb.5353: 0 TXT (QM)? HP LaserJet 400 M401dne (7740E9)._ipp._tcp.local. (66)
17:49:31.982160 IP 192.168.0.25.5353 > 224.0.0.251.5353: 0 TXT (QM)? HP LaserJet 400 M401dne (77A48F)._ipp._tcp.local. (66)
17:49:31.982603 IP 192.168.0.25.5353 > 224.0.0.251.5353: 0 TXT (QM)? HP LaserJet 400 M401dne (77A48F)._ipp._tcp.local. (66)
17:49:31.983045 IP6 fe80::a6dd:c703:eec:6aa2.5353 > ff02::fb.5353: 0 TXT (QM)? HP LaserJet 400 M401dne (77A48F)._ipp._tcp.local. (66)
17:49:31.983387 IP6 fe80::a6dd:c703:eec:6aa2.5353 > ff02::fb.5353: 0 TXT (QM)? HP LaserJet 400 M401dne (77A48F)._ipp._tcp.local. (66)
17:49:31.998148 IP 192.168.0.25.5353 > 224.0.0.251.5353: 0 TXT (QM)? HP LaserJet 400 M401dne (7794D4)._ipp._tcp.local. (66)
17:49:31.998201 IP6 fe80::a6dd:c703:eec:6aa2.5353 > ff02::fb.5353: 0 TXT (QM)? HP LaserJet 400 M401dne (7794D4)._ipp._tcp.local. (66)
17:49:32.009012 IP 192.168.0.153.5353 > 224.0.0.251.5353: 0*- [0q] 1/0/1 (Cache flush) TXT "txtvers=1" "qtotal=1" "pdl=image/urf,application/pdf,application/postscript,application/vnd.hp-PCL,application/vnd.hp-PCLXL,application/PCLm,application/octet-stream" "rp=ipp/print" "URF=V1.3,CP99,W8,OB10,PQ3-4-5,DM1,IS1-2-4,MT1-2-3-5,RS600" "ty=HP LaserJet 400 M401dne" "product=(HP LaserJet 400 M401dne)" "priority=10" "adminurl=http://NPI7794D4.local./hp/device/info_config_AirPrint.html?tab=Networking&menu=AirPrintStatus" "note=" "Color=F" "Duplex=T" "Scan=F" "Fax=F" "UUID=42524453-4736-4333-395a-a01d487794d4" "kind=document,envelope,photo" "PaperMax=legal-A4" "usb_MFG=Hewlett-Packard" "usb_MDL=HP LaserJet 400 M401dne" "mac=a0:1d:48:77:94:d4" (706)
17:49:32.009021 IP6 fe80::a21d:48ff:fe77:94d4.5353 > ff02::fb.5353: 0*- [0q] 1/0/1 (Cache flush) TXT "txtvers=1" "qtotal=1" "pdl=image/urf,application/pdf,application/postscript,application/vnd.hp-PCL,application/vnd.hp-PCLXL,application/PCLm,application/octet-stream" "rp=ipp/print" "URF=V1.3,CP99,W8,OB10,PQ3-4-5,DM1,IS1-2-4,MT1-2-3-5,RS600" "ty=HP LaserJet 400 M401dne" "product=(HP LaserJet 400 M401dne)" "priority=10" "adminurl=http://NPI7794D4.local./hp/device/info_config_AirPrint.html?tab=Networking&menu=AirPrintStatus" "note=" "Color=F" "Duplex=T" "Scan=F" "Fax=F" "UUID=42524453-4736-4333-395a-a01d487794d4" "kind=document,envelope,photo" "PaperMax=legal-A4" "usb_MFG=Hewlett-Packard" "usb_MDL=HP LaserJet 400 M401dne" "mac=a0:1d:48:77:94:d4" (706)
17:49:32.009689 IP 192.168.0.130.55752 > 239.255.255.250.1900: UDP, length 175
17:49:32.029705 IP 192.168.0.25.5353 > 224.0.0.251.5353: 0 TXT (QM)? HP LaserJet 400 M401dne (77404F)._ipp._tcp.local. (66)
17:49:32.030149 IP6 fe80::a6dd:c703:eec:6aa2.5353 > ff02::fb.5353: 0 TXT (QM)? HP LaserJet 400 M401dne (77404F)._ipp._tcp.local. (66)
17:49:32.030682 IP 192.168.0.25.5353 > 224.0.0.251.5353: 0 TXT (QM)? HP LaserJet 400 M401dne (77404F)._ipp._tcp.local. (66)
17:49:32.030867 IP6 fe80::a6dd:c703:eec:6aa2.5353 > ff02::fb.5353: 0 TXT (QM)? HP LaserJet 400 M401dne (77404F)._ipp._tcp.local. (66)
17:49:32.045717 IP 192.168.0.25.5353 > 224.0.0.251.5353: 0 TXT (QM)? HP LaserJet 400 M401dne (77E9C7)._ipp._tcp.local. (66)
17:49:32.046249 IP6 fe80::a6dd:c703:eec:6aa2.5353 > ff02::fb.5353: 0 TXT (QM)? HP LaserJet 400 M401dne (77E9C7)._ipp._tcp.local. (66)
17:49:32.057144 IP 192.168.0.132.5353 > 224.0.0.251.5353: 0*- [0q] 1/0/1 (Cache flush) TXT "txtvers=1" "qtotal=1" "pdl=image/urf,application/pdf,application/postscript,application/vnd.hp-PCL,application/vnd.hp-PCLXL,application/PCLm,application/octet-stream" "rp=ipp/print" "URF=V1.3,CP99,W8,OB10,PQ3-4-5,DM1,IS1-2-4,MT1-2-3-5,RS600" "ty=HP LaserJet 400 M401dne" "product=(HP LaserJet 400 M401dne)" "priority=10" "adminurl=http://NPI77E9C7.local./hp/device/info_config_AirPrint.html?tab=Networking&menu=AirPrintStatus" "note=" "Color=F" "Duplex=T" "Scan=F" "Fax=F" "UUID=42524453-4744-3450-4a4d-a01d4877e9c7" "kind=document,envelope,photo" "PaperMax=legal-A4" "usb_MFG=Hewlett-Packard" "usb_MDL=HP LaserJet 400 M401dne" "mac=a0:1d:48:77:e9:c7" (706)
17:49:32.057153 IP6 fe80::a21d:48ff:fe77:e9c7.5353 > ff02::fb.5353: 0*- [0q] 1/0/1 (Cache flush) TXT "txtvers=1" "qtotal=1" "pdl=image/urf,application/pdf,application/postscript,application/vnd.hp-PCL,application/vnd.hp-PCLXL,application/PCLm,application/octet-stream" "rp=ipp/print" "URF=V1.3,CP99,W8,OB10,PQ3-4-5,DM1,IS1-2-4,MT1-2-3-5,RS600" "ty=HP LaserJet 400 M401dne" "product=(HP LaserJet 400 M401dne)" "priority=10" "adminurl=http://NPI77E9C7.local./hp/device/info_config_AirPrint.html?tab=Networking&menu=AirPrintStatus" "note=" "Color=F" "Duplex=T" "Scan=F" "Fax=F" "UUID=42524453-4744-3450-4a4d-a01d4877e9c7" "kind=document,envelope,photo" "PaperMax=legal-A4" "usb_MFG=Hewlett-Packard" "usb_MDL=HP LaserJet 400 M401dne" "mac=a0:1d:48:77:e9:c7" (706)
17:49:32.093049 IP 192.168.0.25.5353 > 224.0.0.251.5353: 0 TXT (QM)? HP LaserJet 400 M401dne (774095)._ipp._tcp.local. (66)
17:49:32.093384 IP 192.168.0.25.5353 > 224.0.0.251.5353: 0 TXT (QM)? HP LaserJet 400 M401dne (779785)._ipp._tcp.local. (66)
17:49:32.093728 IP6 fe80::a6dd:c703:eec:6aa2.5353 > ff02::fb.5353: 0 TXT (QM)? HP LaserJet 400 M401dne (779785)._ipp._tcp.local. (66)
17:49:32.094350 IP6 fe80::a6dd:c703:eec:6aa2.5353 > ff02::fb.5353: 0 TXT (QM)? HP LaserJet 400 M401dne (774095)._ipp._tcp.local. (66)
17:49:32.094772 IP 192.168.0.25.5353 > 224.0.0.251.5353: 0 TXT (QM)? HP LaserJet 400 M401dne (779785)._ipp._tcp.local. (66)
17:49:32.095027 IP6 fe80::a6dd:c703:eec:6aa2.5353 > ff02::fb.5353: 0 TXT (QM)? HP LaserJet 400 M401dne (779785)._ipp._tcp.local. (66)
17:49:32.102269 IP 192.168.0.55.137 > 192.168.0.255.137: UDP, length 50
17:49:32.102390 IP 192.168.0.55.5353 > 224.0.0.251.5353: 0 A (QM)? NPI7740E8.local. (33)
17:49:32.102452 IP6 fe80::9767:8f1d:89f5:afc8.5353 > ff02::fb.5353: 0 A (QM)? NPI7740E8.local. (33)
17:49:32.102709 IP 192.168.0.55.5353 > 224.0.0.251.5353: 0 AAAA (QM)? NPI7740E8.local. (33)
17:49:32.102796 IP6 fe80::9767:8f1d:89f5:afc8.5353 > ff02::fb.5353: 0 AAAA (QM)? NPI7740E8.local. (33)
17:49:32.103142 IP6 fe80::9767:8f1d:89f5:afc8.64697 > ff02::1:3.5355: UDP, length 27
17:49:32.103291 IP 192.168.0.55.64697 > 224.0.0.252.5355: UDP, length 27
17:49:32.103548 IP6 fe80::9767:8f1d:89f5:afc8.57613 > ff02::1:3.5355: UDP, length 27
17:49:32.103556 IP 192.168.0.55.57613 > 224.0.0.252.5355: UDP, length 27
17:49:32.108931 IP 192.168.0.25.5353 > 224.0.0.251.5353: 0 TXT (QM)? HP LaserJet 400 M401dne (774095)._ipp._tcp.local. (66)
17:49:32.109370 IP6 fe80::a6dd:c703:eec:6aa2.5353 > ff02::fb.5353: 0 TXT (QM)? HP LaserJet 400 M401dne (774095)._ipp._tcp.local. (66)
17:49:32.125062 IP 192.168.0.25.5353 > 224.0.0.251.5353: 0 TXT (QM)? HP LaserJet 400 M401dne (A1DC13)._ipp._tcp.local. (66)
17:49:32.125312 IP6 fe80::a6dd:c703:eec:6aa2.5353 > ff02::fb.5353: 0 TXT (QM)? HP LaserJet 400 M401dne (A1DC13)._ipp._tcp.local. (66)
17:49:32.125813 IP 192.168.0.25.5353 > 224.0.0.251.5353: 0 TXT (QM)? HP LaserJet 400 M401dne (7750D2)._ipp._tcp.local. (66)
17:49:32.125983 IP6 fe80::a6dd:c703:eec:6aa2.5353 > ff02::fb.5353: 0 TXT (QM)? HP LaserJet 400 M401dne (7750D2)._ipp._tcp.local. (66)
17:49:32.141235 IP 192.168.0.25.5353 > 224.0.0.251.5353: 0 TXT (QM)? HP LaserJet 400 M401dne (7750D2)._ipp._tcp.local. (66)
17:49:32.141755 IP6 fe80::a6dd:c703:eec:6aa2.5353 > ff02::fb.5353: 0 TXT (QM)? HP LaserJet 400 M401dne (7750D2)._ipp._tcp.local. (66)
17:49:32.142103 IP 192.168.0.25.5353 > 224.0.0.251.5353: 0 TXT (QM)? HP LaserJet 400 M401dne (A1DC13)._ipp._tcp.local. (66)
17:49:32.142631 IP6 fe80::a6dd:c703:eec:6aa2.5353 > ff02::fb.5353: 0 TXT (QM)? HP LaserJet 400 M401dne (A1DC13)._ipp._tcp.local. (66)
17:49:32.157019 IP 192.168.0.25.5353 > 224.0.0.251.5353: 0 TXT (QM)? HP LaserJet 400 M401dne (7790D5)._ipp._tcp.local. (66)
17:49:32.157212 IP6 fe80::a6dd:c703:eec:6aa2.5353 > ff02::fb.5353: 0 TXT (QM)? HP LaserJet 400 M401dne (7790D5)._ipp._tcp.local. (66)
17:49:32.157903 IP 192.168.0.25.5353 > 224.0.0.251.5353: 0 TXT (QM)? HP LaserJet 400 M401dne (7790D5)._ipp._tcp.local. (66)
17:49:32.158250 IP6 fe80::a6dd:c703:eec:6aa2.5353 > ff02::fb.5353: 0 TXT (QM)? HP LaserJet 400 M401dne (7790D5)._ipp._tcp.local. (66)
17:49:32.158815 ARP, Request who-has 192.168.0.3 tell 192.168.0.234, length 46
17:49:32.158832 ARP, Request who-has 192.168.0.5 tell 192.168.0.234, length 46
17:49:32.173042 IP 192.168.0.25.5353 > 224.0.0.251.5353: 0 TXT (QM)? HP LaserJet 400 M401dne (A1BC94)._ipp._tcp.local. (66)
17:49:32.173228 IP6 fe80::a6dd:c703:eec:6aa2.5353 > ff02::fb.5353: 0 TXT (QM)? HP LaserJet 400 M401dne (A1BC94)._ipp._tcp.local. (66)
17:49:32.187811 ARP, Request who-has 192.168.0.119 tell 192.168.0.254, length 46
17:49:32.188979 IP 192.168.0.25.5353 > 224.0.0.251.5353: 0 TXT (QM)? HP LaserJet 400 M401dne (A1BC94)._ipp._tcp.local. (66)
17:49:32.189193 IP6 fe80::a6dd:c703:eec:6aa2.5353 > ff02::fb.5353: 0 TXT (QM)? HP LaserJet 400 M401dne (A1BC94)._ipp._tcp.local. (66)
17:49:32.205001 IP 192.168.0.25.5353 > 224.0.0.251.5353: 0 TXT (QM)? HP LaserJet 400 M401dne (777358)._ipp._tcp.local. (66)
17:49:32.205258 IP6 fe80::a6dd:c703:eec:6aa2.5353 > ff02::fb.5353: 0 TXT (QM)? HP LaserJet 400 M401dne (777358)._ipp._tcp.local. (66)
17:49:32.205773 IP 192.168.0.25.5353 > 224.0.0.251.5353: 0 TXT (QM)? HP LaserJet 400 M401dne (777358)._ipp._tcp.local. (66)
17:49:32.205994 IP6 fe80::a6dd:c703:eec:6aa2.5353 > ff02::fb.5353: 0 TXT (QM)? HP LaserJet 400 M401dne (777358)._ipp._tcp.local. (66)
17:49:32.227493 IP 192.168.0.154.5353 > 224.0.0.251.5353: 0*- [0q] 1/0/1 (Cache flush) TXT "txtvers=1" "qtotal=1" "pdl=application/postscript,application/vnd.hp-PCL,application/vnd.hp-PCLXL,application/pdf,application/PCLm,application/octet-stream,image/urf" "rp=ipp/print" "URF=V1.1,CP99,W8,OB10,PQ3-4-5,DM1,IS1-2-4,MT1-2-3-5,RS600-1200" "ty=HP LaserJet 400 M401dne" "product=(HP LaserJet 400 M401dne)" "priority=10" "adminurl=http://NPI77404F.local." "note=" "Color=F" "Duplex=T" "Scan=F" "Fax=F" "UUID=42524453-4644-4647-3844-a01d4877404f" "usb_MFG=Hewlett-Packard" "usb_MDL=HP LaserJet 400 M401dne" "mac=a0:1d:48:77:40:4f" (593)
17:49:32.227501 IP6 fe80::a21d:48ff:fe77:404f.5353 > ff02::fb.5353: 0*- [0q] 1/0/1 (Cache flush) TXT "txtvers=1" "qtotal=1" "pdl=application/postscript,application/vnd.hp-PCL,application/vnd.hp-PCLXL,application/pdf,application/PCLm,application/octet-stream,image/urf" "rp=ipp/print" "URF=V1.1,CP99,W8,OB10,PQ3-4-5,DM1,IS1-2-4,MT1-2-3-5,RS600-1200" "ty=HP LaserJet 400 M401dne" "product=(HP LaserJet 400 M401dne)" "priority=10" "adminurl=http://NPI77404F.local." "note=" "Color=F" "Duplex=T" "Scan=F" "Fax=F" "UUID=42524453-4644-4647-3844-a01d4877404f" "usb_MFG=Hewlett-Packard" "usb_MDL=HP LaserJet 400 M401dne" "mac=a0:1d:48:77:40:4f" (593)
17:49:32.237268 IP 192.168.0.25.5353 > 224.0.0.251.5353: 0 TXT (QM)? HP LaserJet 400 M401dn (A14486)._ipp._tcp.local. (65)
17:49:32.237526 IP6 fe80::a6dd:c703:eec:6aa2.5353 > ff02::fb.5353: 0 TXT (QM)? HP LaserJet 400 M401dn (A14486)._ipp._tcp.local. (65)
17:49:32.253261 IP 192.168.0.25.5353 > 224.0.0.251.5353: 0 TXT (QM)? HP LaserJet 400 M401dn (A14486)._ipp._tcp.local. (65)
17:49:32.253766 IP6 fe80::a6dd:c703:eec:6aa2.5353 > ff02::fb.5353: 0 TXT (QM)? HP LaserJet 400 M401dn (A14486)._ipp._tcp.local. (65)
17:49:32.275253 IP 192.168.0.133.5353 > 224.0.0.251.5353: 0*- [0q] 1/0/1 (Cache flush) TXT "txtvers=1" "qtotal=1" "pdl=application/postscript,application/vnd.hp-PCL,application/vnd.hp-PCLXL,application/pdf,image/urf" "rp=ipp/printer" "URF=CP99,W8,OB10,PQ3-4-5,DM1,IS1-2-4,MT1-2-3-5,MT1-2-3-5,RS600-1200" "ty=HP LaserJet 400 M401dn" "product=(HP LaserJet 400 M401dn)" "priority=10" "adminurl=http://NPIA14486.local." "note=" "Color=F" "Duplex=T" "Scan=F" "UUID=42524453-4444-4e33-524d-a0b3cca14486" "usb_MFG=Hewlett-Packard" "usb_MDL=HP LaserJet 400 M401dn" "mac=a0:b3:cc:a1:44:86" (548)
17:49:32.275260 IP6 fe80::a2b3:ccff:fea1:4486.5353 > ff02::fb.5353: 0*- [0q] 1/0/1 (Cache flush) TXT "txtvers=1" "qtotal=1" "pdl=application/postscript,application/vnd.hp-PCL,application/vnd.hp-PCLXL,application/pdf,image/urf" "rp=ipp/printer" "URF=CP99,W8,OB10,PQ3-4-5,DM1,IS1-2-4,MT1-2-3-5,MT1-2-3-5,RS600-1200" "ty=HP LaserJet 400 M401dn" "product=(HP LaserJet 400 M401dn)" "priority=10" "adminurl=http://NPIA14486.local." "note=" "Color=F" "Duplex=T" "Scan=F" "UUID=42524453-4444-4e33-524d-a0b3cca14486" "usb_MFG=Hewlett-Packard" "usb_MDL=HP LaserJet 400 M401dn" "mac=a0:b3:cc:a1:44:86" (548)
17:49:32.277145 IP 192.168.0.164.5353 > 224.0.0.251.5353: 0*- [0q] 1/0/1 (Cache flush) TXT "txtvers=1" "qtotal=1" "pdl=image/urf,application/pdf,application/postscript,application/vnd.hp-PCL,application/vnd.hp-PCLXL,application/PCLm,application/octet-stream" "rp=ipp/print" "URF=V1.3,CP99,W8,OB10,PQ3-4-5,DM1,IS1-2-4,MT1-2-3-5,RS600" "ty=HP LaserJet 400 M401dne" "product=(HP LaserJet 400 M401dne)" "priority=10" "adminurl=http://NPI777358.local./hp/device/info_config_AirPrint.html?tab=Networking&menu=AirPrintStatus" "note=" "Color=F" "Duplex=T" "Scan=F" "Fax=F" "UUID=42524453-4734-5933-4332-a01d48777358" "kind=document,envelope,photo" "PaperMax=legal-A4" "usb_MFG=Hewlett-Packard" "usb_MDL=HP LaserJet 400 M401dne" "mac=a0:1d:48:77:73:58" (706)
17:49:32.277154 IP6 fe80::a21d:48ff:fe77:7358.5353 > ff02::fb.5353: 0*- [0q] 1/0/1 (Cache flush) TXT "txtvers=1" "qtotal=1" "pdl=image/urf,application/pdf,application/postscript,application/vnd.hp-PCL,application/vnd.hp-PCLXL,application/PCLm,application/octet-stream" "rp=ipp/print" "URF=V1.3,CP99,W8,OB10,PQ3-4-5,DM1,IS1-2-4,MT1-2-3-5,RS600" "ty=HP LaserJet 400 M401dne" "product=(HP LaserJet 400 M401dne)" "priority=10" "adminurl=http://NPI777358.local./hp/device/info_config_AirPrint.html?tab=Networking&menu=AirPrintStatus" "note=" "Color=F" "Duplex=T" "Scan=F" "Fax=F" "UUID=42524453-4734-5933-4332-a01d48777358" "kind=document,envelope,photo" "PaperMax=legal-A4" "usb_MFG=Hewlett-Packard" "usb_MDL=HP LaserJet 400 M401dne" "mac=a0:1d:48:77:73:58" (706)
17:49:32.287442 IP6 fe80::a21d:48ff:fe77:40e9.5353 > ff02::fb.5353: 0*- [0q] 1/0/1 (Cache flush) TXT "txtvers=1" "qtotal=1" "pdl=application/postscript,application/vnd.hp-PCL,application/vnd.hp-PCLXL,application/pdf,application/PCLm,application/octet-stream,image/urf" "rp=ipp/print" "URF=V1.1,CP99,W8,OB10,PQ3-4-5,DM1,IS1-2-4,MT1-2-3-5,RS600-1200" "ty=HP LaserJet 400 M401dne" "product=(HP LaserJet 400 M401dne)" "priority=10" "adminurl=http://NPI7740E9.local." "note=" "Color=F" "Duplex=T" "Scan=F" "Fax=F" "UUID=42524453-4644-4647-3843-a01d487740e9" "usb_MFG=Hewlett-Packard" "usb_MDL=HP LaserJet 400 M401dne" "mac=a0:1d:48:77:40:e9" (593)
17:49:32.298195 IP 192.168.0.169.5353 > 224.0.0.251.5353: 0*- [0q] 1/0/1 (Cache flush) TXT "txtvers=1" "qtotal=1" "pdl=application/postscript,application/vnd.hp-PCL,application/vnd.hp-PCLXL,application/pdf,application/PCLm,application/octet-stream,image/urf" "rp=ipp/print" "URF=V1.1,CP99,W8,OB10,PQ3-4-5,DM1,IS1-2-4,MT1-2-3-5,RS600-1200" "ty=HP LaserJet 400 M401dne" "product=(HP LaserJet 400 M401dne)" "priority=10" "adminurl=http://NPI774095.local." "note=" "Color=F" "Duplex=T" "Scan=F" "Fax=F" "UUID=42524453-4644-4647-3847-a01d48774095" "usb_MFG=Hewlett-Packard" "usb_MDL=HP LaserJet 400 M401dne" "mac=a0:1d:48:77:40:95" (593)
17:49:32.298202 IP6 fe80::a21d:48ff:fe77:4095.5353 > ff02::fb.5353: 0*- [0q] 1/0/1 (Cache flush) TXT "txtvers=1" "qtotal=1" "pdl=application/postscript,application/vnd.hp-PCL,application/vnd.hp-PCLXL,application/pdf,application/PCLm,application/octet-stream,image/urf" "rp=ipp/print" "URF=V1.1,CP99,W8,OB10,PQ3-4-5,DM1,IS1-2-4,MT1-2-3-5,RS600-1200" "ty=HP LaserJet 400 M401dne" "product=(HP LaserJet 400 M401dne)" "priority=10" "adminurl=http://NPI774095.local." "note=" "Color=F" "Duplex=T" "Scan=F" "Fax=F" "UUID=42524453-4644-4647-3847-a01d48774095" "usb_MFG=Hewlett-Packard" "usb_MDL=HP LaserJet 400 M401dne" "mac=a0:1d:48:77:40:95" (593)
17:49:32.298285 IP 192.168.0.162.5353 > 224.0.0.251.5353: 0*- [0q] 1/0/1 (Cache flush) TXT "txtvers=1" "qtotal=1" "pdl=application/postscript,application/vnd.hp-PCL,application/vnd.hp-PCLXL,application/pdf,application/PCLm,application/octet-stream,image/urf" "rp=ipp/print" "URF=V1.1,CP99,W8,OB10,PQ3-4-5,DM1,IS1-2-4,MT1-2-3-5,RS600-1200" "ty=HP LaserJet 400 M401dne" "product=(HP LaserJet 400 M401dne)" "priority=10" "adminurl=http://NPIA1DC13.local." "note=" "Color=F" "Duplex=T" "Scan=F" "Fax=F" "UUID=42524453-4642-3947-3847-a0b3cca1dc13" "usb_MFG=Hewlett-Packard" "usb_MDL=HP LaserJet 400 M401dne" "mac=a0:b3:cc:a1:dc:13" (593)
17:49:32.298288 IP6 fe80::a2b3:ccff:fea1:dc13.5353 > ff02::fb.5353: 0*- [0q] 1/0/1 (Cache flush) TXT "txtvers=1" "qtotal=1" "pdl=application/postscript,application/vnd.hp-PCL,application/vnd.hp-PCLXL,application/pdf,application/PCLm,application/octet-stream,image/urf" "rp=ipp/print" "URF=V1.1,CP99,W8,OB10,PQ3-4-5,DM1,IS1-2-4,MT1-2-3-5,RS600-1200" "ty=HP LaserJet 400 M401dne" "product=(HP LaserJet 400 M401dne)" "priority=10" "adminurl=http://NPIA1DC13.local." "note=" "Color=F" "Duplex=T" "Scan=F" "Fax=F" "UUID=42524453-4642-3947-3847-a0b3cca1dc13" "usb_MFG=Hewlett-Packard" "usb_MDL=HP LaserJet 400 M401dne" "mac=a0:b3:cc:a1:dc:13" (593)
17:49:32.322104 IP 192.168.0.156.5353 > 224.0.0.251.5353: 0*- [0q] 1/0/1 (Cache flush) TXT "txtvers=1" "qtotal=1" "pdl=application/postscript,application/vnd.hp-PCL,application/vnd.hp-PCLXL,application/pdf,application/PCLm,application/octet-stream,image/urf" "rp=ipp/print" "URF=V1.1,CP99,W8,OB10,PQ3-4-5,DM1,IS1-2-4,MT1-2-3-5,RS600-1200" "ty=HP LaserJet 400 M401dne" "product=(HP LaserJet 400 M401dne)" "priority=10" "adminurl=http://NPIA1BC94.local." "note=" "Color=F" "Duplex=T" "Scan=F" "Fax=F" "UUID=42524453-4642-3147-3739-a0b3cca1bc94" "usb_MFG=Hewlett-Packard" "usb_MDL=HP LaserJet 400 M401dne" "mac=a0:b3:cc:a1:bc:94" (593)
17:49:32.322111 IP6 fe80::a2b3:ccff:fea1:bc94.5353 > ff02::fb.5353: 0*- [0q] 1/0/1 (Cache flush) TXT "txtvers=1" "qtotal=1" "pdl=application/postscript,application/vnd.hp-PCL,application/vnd.hp-PCLXL,application/pdf,application/PCLm,application/octet-stream,image/urf" "rp=ipp/print" "URF=V1.1,CP99,W8,OB10,PQ3-4-5,DM1,IS1-2-4,MT1-2-3-5,RS600-1200" "ty=HP LaserJet 400 M401dne" "product=(HP LaserJet 400 M401dne)" "priority=10" "adminurl=http://NPIA1BC94.local." "note=" "Color=F" "Duplex=T" "Scan=F" "Fax=F" "UUID=42524453-4642-3147-3739-a0b3cca1bc94" "usb_MFG=Hewlett-Packard" "usb_MDL=HP LaserJet 400 M401dne" "mac=a0:b3:cc:a1:bc:94" (593)
17:49:32.332902 IP 192.168.0.25.5353 > 224.0.0.251.5353: 0 TXT (QM)? HP LaserJet 400 M401dne (A1767E)._ipp._tcp.local. (66)
17:49:32.333036 IP6 fe80::a6dd:c703:eec:6aa2.5353 > ff02::fb.5353: 0 TXT (QM)? HP LaserJet 400 M401dne (A1767E)._ipp._tcp.local. (66)
17:49:32.333562 IP 192.168.0.25.5353 > 224.0.0.251.5353: 0 TXT (QM)? HP LaserJet 400 M401dne (A1767E)._ipp._tcp.local. (66)
17:49:32.333721 IP6 fe80::a6dd:c703:eec:6aa2.5353 > ff02::fb.5353: 0 TXT (QM)? HP LaserJet 400 M401dne (A1767E)._ipp._tcp.local. (66)
17:49:32.344667 IP 192.168.0.149.5353 > 224.0.0.251.5353: 0*- [0q] 1/0/1 (Cache flush) TXT "txtvers=1" "qtotal=1" "pdl=application/postscript,application/vnd.hp-PCL,application/vnd.hp-PCLXL,application/pdf,image/urf" "rp=ipp/print" "URF=V1.1,CP99,W8,OB10,PQ3-4-5,DM1,IS1-2-4,MT1-2-3-5,RS600-1200" "ty=HP LaserJet 400 M401dne" "product=(HP LaserJet 400 M401dne)" "priority=10" "adminurl=http://NPIA1767E.local." "note=" "Color=F" "Duplex=T" "Scan=F" "Fax=F" "UUID=42524453-4633-4b47-3632-a0b3cca1767e" "usb_MFG=Hewlett-Packard" "usb_MDL=HP LaserJet 400 M401dne" "mac=a0:b3:cc:a1:76:7e" (551)
17:49:32.344676 IP6 fe80::a2b3:ccff:fea1:767e.5353 > ff02::fb.5353: 0*- [0q] 1/0/1 (Cache flush) TXT "txtvers=1" "qtotal=1" "pdl=application/postscript,application/vnd.hp-PCL,application/vnd.hp-PCLXL,application/pdf,image/urf" "rp=ipp/print" "URF=V1.1,CP99,W8,OB10,PQ3-4-5,DM1,IS1-2-4,MT1-2-3-5,RS600-1200" "ty=HP LaserJet 400 M401dne" "product=(HP LaserJet 400 M401dne)" "priority=10" "adminurl=http://NPIA1767E.local." "note=" "Color=F" "Duplex=T" "Scan=F" "Fax=F" "UUID=42524453-4633-4b47-3632-a0b3cca1767e" "usb_MFG=Hewlett-Packard" "usb_MDL=HP LaserJet 400 M401dne" "mac=a0:b3:cc:a1:76:7e" (551)
17:49:32.374100 ARP, Request who-has 192.168.0.6 tell 192.168.0.254, length 46
17:49:32.375625 IP 192.168.0.174.5353 > 224.0.0.251.5353: 0*- [0q] 1/0/1 (Cache flush) TXT "txtvers=1" "qtotal=1" "pdl=image/urf,application/pdf,application/postscript,application/vnd.hp-PCL,application/vnd.hp-PCLXL,application/PCLm,application/octet-stream" "rp=ipp/print" "URF=V1.3,CP99,W8,OB10,PQ3-4-5,DM1,IS1-2-4,MT1-2-3-5,RS600" "ty=HP LaserJet 400 M401dne" "product=(HP LaserJet 400 M401dne)" "priority=10" "adminurl=http://NPI779785.local./hp/device/info_config_AirPrint.html?tab=Networking&menu=AirPrintStatus" "note=" "Color=F" "Duplex=T" "Scan=F" "Fax=F" "UUID=42524453-4739-4d50-4d30-a01d48779785" "kind=document,envelope,photo" "PaperMax=legal-A4" "usb_MFG=Hewlett-Packard" "usb_MDL=HP LaserJet 400 M401dne" "mac=a0:1d:48:77:97:85" (706)
17:49:32.375633 IP6 fe80::a21d:48ff:fe77:9785.5353 > ff02::fb.5353: 0*- [0q] 1/0/1 (Cache flush) TXT "txtvers=1" "qtotal=1" "pdl=image/urf,application/pdf,application/postscript,application/vnd.hp-PCL,application/vnd.hp-PCLXL,application/PCLm,application/octet-stream" "rp=ipp/print" "URF=V1.3,CP99,W8,OB10,PQ3-4-5,DM1,IS1-2-4,MT1-2-3-5,RS600" "ty=HP LaserJet 400 M401dne" "product=(HP LaserJet 400 M401dne)" "priority=10" "adminurl=http://NPI779785.local./hp/device/info_config_AirPrint.html?tab=Networking&menu=AirPrintStatus" "note=" "Color=F" "Duplex=T" "Scan=F" "Fax=F" "UUID=42524453-4739-4d50-4d30-a01d48779785" "kind=document,envelope,photo" "PaperMax=legal-A4" "usb_MFG=Hewlett-Packard" "usb_MDL=HP LaserJet 400 M401dne" "mac=a0:1d:48:77:97:85" (706)
17:49:32.409807 IP 192.168.0.163.5353 > 224.0.0.251.5353: 0*- [0q] 1/0/1 (Cache flush) TXT "txtvers=1" "qtotal=1" "pdl=application/postscript,application/vnd.hp-PCL,application/vnd.hp-PCLXL,application/pdf,application/PCLm,application/octet-stream,image/urf" "rp=ipp/print" "URF=V1.1,CP99,W8,OB10,PQ3-4-5,DM1,IS1-2-4,MT1-2-3-5,RS600-1200" "ty=HP LaserJet 400 M401dne" "product=(HP LaserJet 400 M401dne)" "priority=10" "adminurl=http://NPI7790D5.local." "note=" "Color=F" "Duplex=T" "Scan=F" "Fax=F" "UUID=42524453-4731-4647-3230-a01d487790d5" "usb_MFG=Hewlett-Packard" "usb_MDL=HP LaserJet 400 M401dne" "mac=a0:1d:48:77:90:d5" (593)
17:49:32.409815 IP6 fe80::a21d:48ff:fe77:90d5.5353 > ff02::fb.5353: 0*- [0q] 1/0/1 (Cache flush) TXT "txtvers=1" "qtotal=1" "pdl=application/postscript,application/vnd.hp-PCL,application/vnd.hp-PCLXL,application/pdf,application/PCLm,application/octet-stream,image/urf" "rp=ipp/print" "URF=V1.1,CP99,W8,OB10,PQ3-4-5,DM1,IS1-2-4,MT1-2-3-5,RS600-1200" "ty=HP LaserJet 400 M401dne" "product=(HP LaserJet 400 M401dne)" "priority=10" "adminurl=http://NPI7790D5.local." "note=" "Color=F" "Duplex=T" "Scan=F" "Fax=F" "UUID=42524453-4731-4647-3230-a01d487790d5" "usb_MFG=Hewlett-Packard" "usb_MDL=HP LaserJet 400 M401dne" "mac=a0:1d:48:77:90:d5" (593)
17:49:32.418126 ARP, Request who-has 192.168.0.142 tell 192.168.0.254, length 46
17:49:32.441593 IP 192.168.0.151.5353 > 224.0.0.251.5353: 0*- [0q] 1/0/1 (Cache flush) TXT "txtvers=1" "qtotal=1" "pdl=image/urf,application/pdf,application/postscript,application/vnd.hp-PCL,application/vnd.hp-PCLXL,application/PCLm,application/octet-stream" "rp=ipp/print" "URF=V1.3,CP99,W8,OB10,PQ3-4-5,DM1,IS1-2-4,MT1-2-3-5,RS600" "ty=HP LaserJet 400 M401dne" "product=(HP LaserJet 400 M401dne)" "priority=10" "adminurl=http://NPI77A48F.local./hp/device/info_config_AirPrint.html?tab=Networking&menu=AirPrintStatus" "note=" "Color=F" "Duplex=T" "Scan=F" "Fax=F" "UUID=42524453-4736-3533-384c-a01d4877a48f" "kind=document,envelope,photo" "PaperMax=legal-A4" "usb_MFG=Hewlett-Packard" "usb_MDL=HP LaserJet 400 M401dne" "mac=a0:1d:48:77:a4:8f" (706)
17:49:32.441596 IP6 fe80::a21d:48ff:fe77:a48f.5353 > ff02::fb.5353: 0*- [0q] 1/0/1 (Cache flush) TXT "txtvers=1" "qtotal=1" "pdl=image/urf,application/pdf,application/postscript,application/vnd.hp-PCL,application/vnd.hp-PCLXL,application/PCLm,application/octet-stream" "rp=ipp/print" "URF=V1.3,CP99,W8,OB10,PQ3-4-5,DM1,IS1-2-4,MT1-2-3-5,RS600" "ty=HP LaserJet 400 M401dne" "product=(HP LaserJet 400 M401dne)" "priority=10" "adminurl=http://NPI77A48F.local./hp/device/info_config_AirPrint.html?tab=Networking&menu=AirPrintStatus" "note=" "Color=F" "Duplex=T" "Scan=F" "Fax=F" "UUID=42524453-4736-3533-384c-a01d4877a48f" "kind=document,envelope,photo" "PaperMax=legal-A4" "usb_MFG=Hewlett-Packard" "usb_MDL=HP LaserJet 400 M401dne" "mac=a0:1d:48:77:a4:8f" (706)
17:49:32.452414 IP 192.168.0.188.5353 > 224.0.0.251.5353: 0*- [0q] 1/0/1 (Cache flush) TXT "txtvers=1" "qtotal=1" "pdl=application/postscript,application/vnd.hp-PCL,application/vnd.hp-PCLXL,application/pdf,application/PCLm,application/octet-stream,image/urf" "rp=ipp/print" "URF=V1.1,CP99,W8,OB10,PQ3-4-5,DM1,IS1-2-4,MT1-2-3-5,RS600-1200" "ty=HP LaserJet 400 M401dne" "product=(HP LaserJet 400 M401dne)" "priority=10" "adminurl=http://NPI7750D2.local." "note=" "Color=F" "Duplex=T" "Scan=F" "Fax=F" "UUID=42524453-4731-4647-324e-a01d487750d2" "usb_MFG=Hewlett-Packard" "usb_MDL=HP LaserJet 400 M401dne" "mac=a0:1d:48:77:50:d2" (593)
17:49:32.452417 IP6 fe80::a21d:48ff:fe77:50d2.5353 > ff02::fb.5353: 0*- [0q] 1/0/1 (Cache flush) TXT "txtvers=1" "qtotal=1" "pdl=application/postscript,application/vnd.hp-PCL,application/vnd.hp-PCLXL,application/pdf,application/PCLm,application/octet-stream,image/urf" "rp=ipp/print" "URF=V1.1,CP99,W8,OB10,PQ3-4-5,DM1,IS1-2-4,MT1-2-3-5,RS600-1200" "ty=HP LaserJet 400 M401dne" "product=(HP LaserJet 400 M401dne)" "priority=10" "adminurl=http://NPI7750D2.local." "note=" "Color=F" "Duplex=T" "Scan=F" "Fax=F" "UUID=42524453-4731-4647-324e-a01d487750d2" "usb_MFG=Hewlett-Packard" "usb_MDL=HP LaserJet 400 M401dne" "mac=a0:1d:48:77:50:d2" (593)
17:49:32.529327 IP6 fe80::9767:8f1d:89f5:afc8.57613 > ff02::1:3.5355: UDP, length 27
17:49:32.529335 IP6 fe80::9767:8f1d:89f5:afc8.64697 > ff02::1:3.5355: UDP, length 27
17:49:32.529337 IP 192.168.0.55.57613 > 224.0.0.252.5355: UDP, length 27
17:49:32.529351 IP 192.168.0.55.64697 > 224.0.0.252.5355: UDP, length 27
17:49:32.699314 IP 192.168.0.84.50006 > 239.255.255.250.1900: UDP, length 174
17:49:32.728379 IP 192.168.0.88.63379 > 239.255.255.250.1900: UDP, length 175
17:49:32.827667 IP 192.168.0.230.59440 > 239.255.255.250.1900: UDP, length 174
17:49:32.852057 IP 192.168.0.55.137 > 192.168.0.255.137: UDP, length 50
17:49:32.913082 f4:a4:d6:aa:51:80 > ff:ff:ff:ff:ff:ff, ethertype Unknown (0x9998), length 60: 
	0x0000:  0001 0000 0010 0000 0004 0000 0000 0000  ................
	0x0010:  0000 0000 0000 0000 0000 0000 0000 0000  ................
	0x0020:  0000 0000 0000 0000 0000 0000 0000       ..............
17:49:33.010757 ARP, Request who-has 192.168.0.3 tell 192.168.0.234, length 46
17:49:33.010774 ARP, Request who-has 192.168.0.5 tell 192.168.0.234, length 46
17:49:33.015397 IP 192.168.0.130.55752 > 239.255.255.250.1900: UDP, length 175
17:49:33.113721 IP 192.168.0.55.5353 > 224.0.0.251.5353: 0 A (QM)? NPI7740E8.local. (33)
17:49:33.113871 IP6 fe80::9767:8f1d:89f5:afc8.5353 > ff02::fb.5353: 0 A (QM)? NPI7740E8.local. (33)
17:49:33.114016 IP 192.168.0.55.5353 > 224.0.0.251.5353: 0 AAAA (QM)? NPI7740E8.local. (33)
17:49:33.114136 IP6 fe80::9767:8f1d:89f5:afc8.5353 > ff02::fb.5353: 0 AAAA (QM)? NPI7740E8.local. (33)
17:49:33.117965 IP6 fe80::a2b3:ccff:fea1:dc13 > ff02::1:fff8:d5b7: ICMP6, neighbor solicitation, who has fe80::18eb:ca0f:5f8:d5b7, length 32
17:49:33.119497 IP 192.168.0.70.137 > 192.168.0.255.137: UDP, length 50
17:49:33.119782 IP 192.168.0.70.5353 > 224.0.0.251.5353: 0 A (QM)? NPIA1DC13.local. (33)
17:49:33.119790 IP6 fe80::18eb:ca0f:5f8:d5b7.5353 > ff02::fb.5353: 0 A (QM)? NPIA1DC13.local. (33)
17:49:33.120203 IP 192.168.0.70.5353 > 224.0.0.251.5353: 0 AAAA (QM)? NPIA1DC13.local. (33)
17:49:33.120211 IP6 fe80::18eb:ca0f:5f8:d5b7.5353 > ff02::fb.5353: 0 AAAA (QM)? NPIA1DC13.local. (33)
17:49:33.120705 IP6 fe80::18eb:ca0f:5f8:d5b7.60286 > ff02::1:3.5355: UDP, length 27
17:49:33.120713 IP 192.168.0.70.60286 > 224.0.0.252.5355: UDP, length 27
17:49:33.121090 IP6 fe80::18eb:ca0f:5f8:d5b7.55438 > ff02::1:3.5355: UDP, length 27
17:49:33.121098 IP 192.168.0.70.55438 > 224.0.0.252.5355: UDP, length 27
17:49:33.173725 IP 192.168.0.162.5353 > 224.0.0.251.5353: 0*- [0q] 1/0/1 (Cache flush) A 192.168.0.162 (60)
17:49:33.173733 IP6 fe80::a2b3:ccff:fea1:dc13.5353 > ff02::fb.5353: 0*- [0q] 1/0/1 (Cache flush) AAAA fe80::a2b3:ccff:fea1:dc13 (75)
17:49:33.189263 ARP, Request who-has 192.168.0.119 tell 192.168.0.254, length 46
17:49:33.334310 IP 192.168.0.20.40620 > 239.255.255.250.1900: UDP, length 171
17:49:33.375504 ARP, Request who-has 192.168.0.6 tell 192.168.0.254, length 46
17:49:33.376229 ARP, Request who-has 192.168.0.108 tell 192.168.0.156, length 46
17:49:33.376443 ARP, Request who-has 192.168.0.108 tell 192.168.0.188, length 46
17:49:33.419265 ARP, Request who-has 192.168.0.142 tell 192.168.0.254, length 46
17:49:33.441344 IP 192.168.0.228.38881 > 8.8.8.8.53: 46250+ A? mobile.events.data.microsoft.com. (50)
17:49:33.441362 IP 192.168.0.228.38881 > 8.8.8.8.53: 42657+ AAAA? mobile.events.data.microsoft.com. (50)
17:49:33.468908 IP 8.8.8.8.53 > 192.168.0.228.38881: 46250 3/0/0 CNAME mobile.events.data.trafficmanager.net., CNAME onedscolprdwus09.westus.cloudapp.azure.com., A 20.189.173.10 (170)
17:49:33.470063 IP 8.8.8.8.53 > 192.168.0.228.38881: 42657 2/1/0 CNAME mobile.events.data.trafficmanager.net., CNAME onedscolprdwus09.westus.cloudapp.azure.com. (214)
17:49:33.470359 IP 192.168.0.228.55182 > 20.189.173.10.443: Flags [S], seq 44850127, win 64240, options [mss 1460,sackOK,TS val 3527851443 ecr 0,nop,wscale 7], length 0
17:49:33.602544 IP 192.168.0.55.137 > 192.168.0.255.137: UDP, length 50
17:49:33.675823 IP 20.189.173.10.443 > 192.168.0.228.55182: Flags [S.], seq 2047077869, ack 44850128, win 65535, options [mss 1440,nop,wscale 8,nop,nop,sackOK], length 0
17:49:33.675892 IP 192.168.0.228.55182 > 20.189.173.10.443: Flags [.], ack 1, win 502, length 0
17:49:33.676472 IP 192.168.0.228.55182 > 20.189.173.10.443: Flags [P.], seq 1:518, ack 1, win 502, length 517
17:49:33.708164 IP 192.168.0.84.50006 > 239.255.255.250.1900: UDP, length 174
17:49:33.735248 IP 192.168.0.88.63379 > 239.255.255.250.1900: UDP, length 175
17:49:33.818335 STP 802.1w, Rapid STP, Flags [Learn, Forward, Agreement], bridge-id 8000.18:7a:3b:cd:42:9b.8006, length 36
17:49:33.828846 IP 192.168.0.230.59440 > 239.255.255.250.1900: UDP, length 174
17:49:33.933980 IP 20.189.173.10.443 > 192.168.0.228.55182: Flags [.], ack 518, win 2051, length 0
17:49:33.960086 IP 20.189.173.10.443 > 192.168.0.228.55182: Flags [P.], seq 1:4507, ack 518, win 2051, length 4506
17:49:33.960161 IP 192.168.0.228.55182 > 20.189.173.10.443: Flags [.], ack 4507, win 484, length 0
17:49:33.965448 IP 192.168.0.228.55182 > 20.189.173.10.443: Flags [P.], seq 518:676, ack 4507, win 501, length 158
17:49:33.968379 ARP, Request who-has 192.168.0.5 tell 192.168.0.230, length 46
17:49:34.005272 ARP, Request who-has 192.168.0.3 tell 192.168.0.234, length 46
17:49:34.005279 ARP, Request who-has 192.168.0.5 tell 192.168.0.234, length 46
17:49:34.019869 IP 192.168.0.130.55752 > 239.255.255.250.1900: UDP, length 175
17:49:34.146599 IP 192.168.0.222.52894 > 239.255.255.250.1900: UDP, length 175
17:49:34.177361 IP 20.189.173.10.443 > 192.168.0.228.55182: Flags [P.], seq 4507:4558, ack 676, win 2050, length 51
17:49:34.179612 IP 192.168.0.228.55182 > 20.189.173.10.443: Flags [.], seq 676:2116, ack 4558, win 501, length 1440
17:49:34.179623 IP 192.168.0.228.55182 > 20.189.173.10.443: Flags [P.], seq 2116:3556, ack 4558, win 501, length 1440
17:49:34.179730 IP 192.168.0.228.55182 > 20.189.173.10.443: Flags [.], seq 3556:4996, ack 4558, win 501, length 1440
17:49:34.179739 IP 192.168.0.228.55182 > 20.189.173.10.443: Flags [P.], seq 4996:5251, ack 4558, win 501, length 255
17:49:34.191400 ARP, Request who-has 192.168.0.119 tell 192.168.0.254, length 46
17:49:34.335251 IP 192.168.0.20.40620 > 239.255.255.250.1900: UDP, length 171
17:49:34.359485 IP 192.168.0.55.137 > 192.168.0.255.137: UDP, length 50
17:49:34.359810 IP 192.168.0.55.5353 > 224.0.0.251.5353: 0 A (QM)? NPI7740E8.local. (33)
17:49:34.359887 IP6 fe80::9767:8f1d:89f5:afc8.5353 > ff02::fb.5353: 0 A (QM)? NPI7740E8.local. (33)
17:49:34.360154 IP 192.168.0.55.5353 > 224.0.0.251.5353: 0 AAAA (QM)? NPI7740E8.local. (33)
17:49:34.360223 IP6 fe80::9767:8f1d:89f5:afc8.5353 > ff02::fb.5353: 0 AAAA (QM)? NPI7740E8.local. (33)
17:49:34.360678 IP6 fe80::9767:8f1d:89f5:afc8.52603 > ff02::1:3.5355: UDP, length 27
17:49:34.360686 IP 192.168.0.55.52603 > 224.0.0.252.5355: UDP, length 27
17:49:34.360977 IP6 fe80::9767:8f1d:89f5:afc8.55838 > ff02::1:3.5355: UDP, length 27
17:49:34.360985 IP 192.168.0.55.55838 > 224.0.0.252.5355: UDP, length 27
17:49:34.377508 ARP, Request who-has 192.168.0.6 tell 192.168.0.254, length 46
17:49:34.384966 IP 20.189.173.10.443 > 192.168.0.228.55182: Flags [.], ack 3556, win 2053, length 0
17:49:34.384973 IP 20.189.173.10.443 > 192.168.0.228.55182: Flags [.], ack 5251, win 2053, length 0
17:49:34.421536 ARP, Request who-has 192.168.0.142 tell 192.168.0.254, length 46
17:49:34.445087 IP 20.189.173.10.443 > 192.168.0.228.55182: Flags [FP.], seq 4558:5029, ack 5251, win 2053, length 471
17:49:34.446119 IP 192.168.0.228.55182 > 20.189.173.10.443: Flags [P.], seq 5251:5282, ack 5030, win 501, length 31
17:49:34.446576 IP 192.168.0.228.55182 > 20.189.173.10.443: Flags [F.], seq 5282, ack 5030, win 501, length 0
17:49:34.658003 IP 20.189.173.10.443 > 192.168.0.228.55182: Flags [.], ack 5283, win 2053, length 0
17:49:34.660101 ARP, Request who-has 192.168.0.5 tell 192.168.0.230, length 46
17:49:34.722498 IP 192.168.0.84.50006 > 239.255.255.250.1900: UDP, length 174
17:49:34.780647 IP6 fe80::9767:8f1d:89f5:afc8.55838 > ff02::1:3.5355: UDP, length 27
17:49:34.780655 IP 192.168.0.55.55838 > 224.0.0.252.5355: UDP, length 27
17:49:34.780669 IP6 fe80::9767:8f1d:89f5:afc8.52603 > ff02::1:3.5355: UDP, length 27
17:49:34.780674 IP 192.168.0.55.52603 > 224.0.0.252.5355: UDP, length 27
17:49:34.828965 IP 192.168.0.230.59440 > 239.255.255.250.1900: UDP, length 174
17:49:35.110293 IP6 fe80::1a7a:3bff:fecd:5859.546 > ff02::1:2.547: dhcp6 inf-req
17:49:35.113275 IP 192.168.0.55.137 > 192.168.0.255.137: UDP, length 50
17:49:35.160299 IP 192.168.0.222.52894 > 239.255.255.250.1900: UDP, length 175
17:49:35.260425 ARP, Request who-has 192.168.0.119 tell 192.168.0.254, length 46
17:49:35.336852 IP 192.168.0.20.40620 > 239.255.255.250.1900: UDP, length 171
17:49:35.366938 IP 192.168.0.55.5353 > 224.0.0.251.5353: 0 AAAA (QM)? NPI7740E8.local. (33)
17:49:35.366946 IP6 fe80::9767:8f1d:89f5:afc8.5353 > ff02::fb.5353: 0 AAAA (QM)? NPI7740E8.local. (33)
17:49:35.367080 IP 192.168.0.55.5353 > 224.0.0.251.5353: 0 A (QM)? NPI7740E8.local. (33)
17:49:35.367180 IP6 fe80::9767:8f1d:89f5:afc8.5353 > ff02::fb.5353: 0 A (QM)? NPI7740E8.local. (33)
17:49:35.368594 ARP, Request who-has 192.168.0.180 tell 192.168.0.195, length 46
17:49:35.454507 IP 192.168.0.228.35631 > 8.8.8.8.53: 19643+ A? mobile.events.data.microsoft.com. (50)
17:49:35.454524 IP 192.168.0.228.35631 > 8.8.8.8.53: 53696+ AAAA? mobile.events.data.microsoft.com. (50)
17:49:35.482046 IP 8.8.8.8.53 > 192.168.0.228.35631: 19643 3/0/0 CNAME mobile.events.data.trafficmanager.net., CNAME onedscolprdcus12.centralus.cloudapp.azure.com., A 13.89.179.10 (173)
17:49:35.483157 IP 8.8.8.8.53 > 192.168.0.228.35631: 53696 2/1/0 CNAME mobile.events.data.trafficmanager.net., CNAME onedscolprdwus13.westus.cloudapp.azure.com. (214)
17:49:35.483495 IP 192.168.0.228.59846 > 13.89.179.10.443: Flags [S], seq 2154789595, win 64240, options [mss 1460,sackOK,TS val 1685688090 ecr 0,nop,wscale 7], length 0
17:49:35.508513 ARP, Request who-has 192.168.0.6 tell 192.168.0.254, length 46
17:49:35.656127 IP 13.89.179.10.443 > 192.168.0.228.59846: Flags [S.], seq 2383419577, ack 2154789596, win 65535, options [mss 1440,nop,wscale 8,nop,nop,sackOK], length 0
17:49:35.656198 IP 192.168.0.228.59846 > 13.89.179.10.443: Flags [.], ack 1, win 502, length 0
17:49:35.656780 IP 192.168.0.228.59846 > 13.89.179.10.443: Flags [P.], seq 1:518, ack 1, win 502, length 517
17:49:35.658677 ARP, Request who-has 192.168.0.5 tell 192.168.0.230, length 46
17:49:35.802725 IP 192.168.0.182.137 > 192.168.0.255.137: UDP, length 50
17:49:35.802733 IP 192.168.0.182.5353 > 224.0.0.251.5353: 0 A (QM)? NPI7790D5.local. (33)
17:49:35.802914 IP6 fe80::5af1:4e07:1a8b:d774.5353 > ff02::fb.5353: 0 A (QM)? NPI7790D5.local. (33)
17:49:35.803134 IP 192.168.0.182.5353 > 224.0.0.251.5353: 0 AAAA (QM)? NPI7790D5.local. (33)
17:49:35.803233 IP6 fe80::5af1:4e07:1a8b:d774.5353 > ff02::fb.5353: 0 AAAA (QM)? NPI7790D5.local. (33)
17:49:35.803700 IP6 fe80::5af1:4e07:1a8b:d774.59444 > ff02::1:3.5355: UDP, length 27
17:49:35.803708 IP 192.168.0.182.59444 > 224.0.0.252.5355: UDP, length 27
17:49:35.803722 IP 192.168.0.163.5353 > 224.0.0.251.5353: 0*- [0q] 1/0/1 (Cache flush) A 192.168.0.163 (60)
17:49:35.803788 IP6 fe80::a21d:48ff:fe77:90d5.5353 > ff02::fb.5353: 0*- [0q] 0/0/1 (47)
17:49:35.803815 IP6 fe80::5af1:4e07:1a8b:d774.52594 > ff02::1:3.5355: UDP, length 27
17:49:35.803833 IP 192.168.0.182.52594 > 224.0.0.252.5355: UDP, length 27
17:49:35.818297 STP 802.1w, Rapid STP, Flags [Learn, Forward, Agreement], bridge-id 8000.18:7a:3b:cd:42:9b.8006, length 36
17:49:35.832122 IP 13.89.179.10.443 > 192.168.0.228.59846: Flags [P.], seq 1:4508, ack 518, win 2051, length 4507
17:49:35.832202 IP 192.168.0.228.59846 > 13.89.179.10.443: Flags [.], ack 4508, win 484, length 0
17:49:35.838392 IP 192.168.0.228.59846 > 13.89.179.10.443: Flags [P.], seq 518:676, ack 4508, win 501, length 158
17:49:35.871787 IP 192.168.0.55.137 > 192.168.0.255.137: UDP, length 50
17:49:35.886421 ARP, Request who-has 192.168.0.180 tell 192.168.0.195, length 46
17:49:35.916740 IP 192.168.0.163.5353 > 224.0.0.251.5353: 0*- [0q] 0/0/1 (44)
17:49:35.916743 IP6 fe80::a21d:48ff:fe77:90d5.5353 > ff02::fb.5353: 0*- [0q] 1/0/1 (Cache flush) AAAA fe80::a21d:48ff:fe77:90d5 (75)
17:49:36.018152 IP 13.89.179.10.443 > 192.168.0.228.59846: Flags [P.], seq 4508:4559, ack 676, win 2050, length 51
17:49:36.020634 IP 192.168.0.228.59846 > 13.89.179.10.443: Flags [.], seq 676:2116, ack 4559, win 501, length 1440
17:49:36.020644 IP 192.168.0.228.59846 > 13.89.179.10.443: Flags [P.], seq 2116:3556, ack 4559, win 501, length 1440
17:49:36.020752 IP 192.168.0.228.59846 > 13.89.179.10.443: Flags [.], seq 3556:4996, ack 4559, win 501, length 1440
17:49:36.020761 IP 192.168.0.228.59846 > 13.89.179.10.443: Flags [P.], seq 4996:5251, ack 4559, win 501, length 255
